{
  "schema_version": "2.0",
  "project_id": "001-the-ai-race-no-one-can-afford-to-win",
  "target_duration_sec": 660,
  "total_duration_sec": 719.928,
  "scene_count": 33,
  "scenes": [
    {
      "scene_id": "scene_001",
      "start_sec": 0.0,
      "end_sec": 28.78,
      "duration_sec": 28.78,
      "purpose": "Cold open: establish that AI labs know the risk and race anyway.",
      "visual_need": "Rapid, restrained cross-cuts between a data-center exterior, an anonymous AI-company office at night, and a government building facade, all in parallel motion.",
      "mood": "tense",
      "on_screen_text": null,
      "transition_in": "fade",
      "transition_out": "cut",
      "voice_line_ref": "voice_script.txt para 1-2: \"Every major AI lab on Earth believes moving this fast might be dangerous...\""
    },
    {
      "scene_id": "scene_002",
      "start_sec": 28.78,
      "end_sec": 51.546,
      "duration_sec": 22.766,
      "purpose": "Land the thesis question the film sits with.",
      "visual_need": "A single held wide shot (server hallway or night skyline) as narration delivers the core question; short, declarative close.",
      "mood": "tense",
      "on_screen_text": null,
      "transition_in": "cut",
      "transition_out": "dissolve",
      "voice_line_ref": "voice_script.txt para 3-4: \"That fear is the real engine... Not someday. Right now.\""
    },
    {
      "scene_id": "scene_003",
      "start_sec": 51.546,
      "end_sec": 70.446,
      "duration_sec": 18.9,
      "purpose": "Set up the section's core assumption: that danger would announce itself.",
      "visual_need": "Clinical research-lab exterior or corridor; calm, procedural, not ominous.",
      "mood": "curious",
      "on_screen_text": null,
      "transition_in": "dissolve",
      "transition_out": "cut",
      "voice_line_ref": "voice_script.txt para 5: \"It's tempting to think we'd know if something were seriously wrong...\""
    },
    {
      "scene_id": "scene_004",
      "start_sec": 70.446,
      "end_sec": 89.347,
      "duration_sec": 18.901,
      "purpose": "Introduce controlled model evaluations as designed adversarial tests.",
      "visual_need": "Closed-door testing room: evaluation dashboards and monitors showing abstracted (non-literal) test-scenario UI \u2014 charts, status flags, not code.",
      "mood": "tense",
      "on_screen_text": "CONTROLLED EVALUATION",
      "transition_in": "cut",
      "transition_out": "cut",
      "voice_line_ref": "voice_script.txt para 6: \"In controlled evaluations, researchers have deliberately pushed frontier models...\""
    },
    {
      "scene_id": "scene_005",
      "start_sec": 89.347,
      "end_sec": 111.254,
      "duration_sec": 21.907,
      "purpose": "Depict the specific reported blackmail-style test case at a high level, without dramatization.",
      "visual_need": "Continuation of the evaluation-room setting; abstract representation of a flagged/highlighted test transcript, no literal chat-log text rendered.",
      "mood": "tense",
      "on_screen_text": "SIMULATED TEST SCENARIO",
      "transition_in": "cut",
      "transition_out": "dissolve",
      "voice_line_ref": "voice_script.txt para 7: \"In one widely reported case, a model given access to fictional emails...\""
    },
    {
      "scene_id": "scene_006",
      "start_sec": 111.254,
      "end_sec": 140.034,
      "duration_sec": 28.78,
      "purpose": "Deliver the film's clarifying distinction: designed test vs. real-world incident (the 'fire drill' framing).",
      "visual_need": "A literal, calm fire-drill/alarm-test visual as the narration's own metaphor \u2014 non-graphic, procedural, safety-drill imagery.",
      "mood": "reflective",
      "on_screen_text": "DESIGNED TEST \u2014 NOT AN ACTUAL EVENT",
      "transition_in": "dissolve",
      "transition_out": "dissolve",
      "voice_line_ref": "voice_script.txt para 8-9: \"None of this happened in the wild... the difference between a fire drill and a fire.\""
    },
    {
      "scene_id": "scene_007",
      "start_sec": 140.034,
      "end_sec": 158.075,
      "duration_sec": 18.041,
      "purpose": "Introduce the structural question of why labs keep building despite acknowledged risk.",
      "visual_need": "Tense boardroom or strategy-meeting interior, generic/unbranded.",
      "mood": "tense",
      "on_screen_text": null,
      "transition_in": "dissolve",
      "transition_out": "cut",
      "voice_line_ref": "voice_script.txt para 10: \"The natural response is to ask why anyone would keep building...\""
    },
    {
      "scene_id": "scene_008",
      "start_sec": 158.075,
      "end_sec": 178.693,
      "duration_sec": 20.618,
      "purpose": "Explain market and investor pressure driving the race between labs and states.",
      "visual_need": "Stock-ticker style displays and a data-center scaling-up motif; abstract racing/overtaking visual motif.",
      "mood": "tense",
      "on_screen_text": null,
      "transition_in": "cut",
      "transition_out": "cut",
      "voice_line_ref": "voice_script.txt para 11: \"Markets reward whoever ships the most capable model first...\""
    },
    {
      "scene_id": "scene_009",
      "start_sec": 178.693,
      "end_sec": 203.607,
      "duration_sec": 24.914,
      "purpose": "Depict the specific reported overtaking-benchmark and CEO-emergency event as a real, hedged, reported occurrence.",
      "visual_need": "Abstract benchmark leaderboard visual (generic bar chart, unbranded) shifting rank; newsroom-style ticker text conveying 'reportedly'.",
      "mood": "tense",
      "on_screen_text": "REPORTED",
      "transition_in": "cut",
      "transition_out": "dissolve",
      "voice_line_ref": "voice_script.txt para 12: \"Late in 2025, a rival's model reportedly overtook one leading company's flagship...\""
    },
    {
      "scene_id": "scene_010",
      "start_sec": 203.607,
      "end_sec": 210.051,
      "duration_sec": 6.444,
      "purpose": "Deliver the section's closing thesis line on why unilateral slowdown fails.",
      "visual_need": "Short punchy visual: a single racer/vehicle motif overtaking, or a baton-handoff style abstraction implying 'ceding the lead'.",
      "mood": "somber",
      "on_screen_text": null,
      "transition_in": "dissolve",
      "transition_out": "fade",
      "voice_line_ref": "voice_script.txt para 13: \"Slowing down alone doesn't remove the risk...\""
    },
    {
      "scene_id": "scene_011",
      "start_sec": 210.051,
      "end_sec": 221.219,
      "duration_sec": 11.168,
      "purpose": "Transition into the risk-spectrum sections: institutions can't absorb the pace.",
      "visual_need": "Wide shot conveying institutional scale being outpaced \u2014 a large regulatory/government building against a fast-moving sky or traffic time-lapse.",
      "mood": "somber",
      "on_screen_text": null,
      "transition_in": "fade",
      "transition_out": "cut",
      "voice_line_ref": "voice_script.txt para 14: \"The deeper problem is that this competitive pressure...\""
    },
    {
      "scene_id": "scene_012",
      "start_sec": 221.219,
      "end_sec": 254.724,
      "duration_sec": 33.505,
      "purpose": "Present the real, disclosed cyber-misuse case (coding-model-enabled extortion) as an actual reported incident.",
      "visual_need": "A darkened analyst workstation with an abstract, non-literal security-dashboard UI (alerts, graphs) \u2014 no depiction of actual exploit code or technique.",
      "mood": "tense",
      "on_screen_text": "DISCLOSED BY THE COMPANY \u2014 REPORTED INCIDENT",
      "transition_in": "cut",
      "transition_out": "cut",
      "voice_line_ref": "voice_script.txt para 15: \"In cybersecurity, AI has already lowered the barrier to entry...\""
    },
    {
      "scene_id": "scene_013",
      "start_sec": 254.724,
      "end_sec": 281.356,
      "duration_sec": 26.632,
      "purpose": "Present the hedge (company's own assessment, not independently verified) and the balancing point that automation also helps defenders.",
      "visual_need": "Split visual: the same SOC-style room reframed to show analysts actively investigating/defending, conveying balance rather than pure threat.",
      "mood": "neutral",
      "on_screen_text": "COMPANY'S OWN ASSESSMENT \u2014 NOT INDEPENDENTLY VERIFIED",
      "transition_in": "cut",
      "transition_out": "dissolve",
      "voice_line_ref": "voice_script.txt para 16: \"These are the company's own assessments of its own product's misuse...\""
    },
    {
      "scene_id": "scene_014",
      "start_sec": 281.356,
      "end_sec": 301.545,
      "duration_sec": 20.189,
      "purpose": "Present the biological-risk capability-boost finding at a high, non-operational level.",
      "visual_need": "Secure biosecurity-lab exterior only \u2014 cautious, non-graphic, no interior lab-procedure imagery.",
      "mood": "somber",
      "on_screen_text": null,
      "transition_in": "dissolve",
      "transition_out": "fade",
      "voice_line_ref": "voice_script.txt para 17: \"On biological risk, the safety frameworks leading labs published in 2025...\""
    },
    {
      "scene_id": "scene_015",
      "start_sec": 301.545,
      "end_sec": 327.318,
      "duration_sec": 25.773,
      "purpose": "Extend the risk spectrum to information-ecosystem and political-manipulation concerns.",
      "visual_need": "A crowded, fast-scrolling social-media feed abstraction conveying volume and ambiguity, not any specific real platform or post.",
      "mood": "somber",
      "on_screen_text": null,
      "transition_in": "fade",
      "transition_out": "cut",
      "voice_line_ref": "voice_script.txt para 18: \"Beyond cyber and bio, the risk spreads into subtler territory...\""
    },
    {
      "scene_id": "scene_016",
      "start_sec": 327.318,
      "end_sec": 362.971,
      "duration_sec": 35.653,